Nutze Device: cuda
Trainiere alle Modelle von Grund auf (kein Warm-Start).
Starte Optuna mit 30 Trials ...
[I 2026-06-08 11:17:29,829] Trial 0 finished with value: 0.17394652567404512 and parameters: {'lr': 0.0001025350969016849, 'optimizer': 'adam', 'weight_decay': 4.2079886696066345e-06, 'dropout': 0.1, 'image_size': 128, 'batch_size': 128, 'positive_multiplier': 2}. Best is trial 0 with value: 0.17394652567404512.
[I 2026-06-08 11:21:16,535] Trial 1 finished with value: 0.3949061658194326 and parameters: {'lr': 3.0955664602423724e-05, 'optimizer': 'sgd', 'weight_decay': 5.34293726127978e-05, 'dropout': 0.2, 'image_size': 96, 'batch_size': 128, 'positive_multiplier': 4}. Best is trial 0 with value: 0.17394652567404512.
[I 2026-06-08 11:25:01,282] Trial 2 finished with value: 0.1474792910540373 and parameters: {'lr': 0.00039710847107924746, 'optimizer': 'adamw', 'weight_decay': 1.8205657658407268e-06, 'dropout': 0.6, 'image_size': 96, 'batch_size': 64, 'positive_multiplier': 3}. Best is trial 2 with value: 0.1474792910540373.
[I 2026-06-08 11:29:43,489] Trial 3 finished with value: 0.30843753324087403 and parameters: {'lr': 1.2382649697023537e-05, 'optimizer': 'adam', 'weight_decay': 1.7654048052495086e-05, 'dropout': 0.30000000000000004, 'image_size': 160, 'batch_size': 64, 'positive_multiplier': 6}. Best is trial 2 with value: 0.1474792910540373.
[I 2026-06-08 11:33:46,150] Trial 4 finished with value: 0.5286794684282372 and parameters: {'lr': 1.7331598058558698e-05, 'optimizer': 'sgd', 'weight_decay': 3.58681649862755e-05, 'dropout': 0.1, 'image_size': 96, 'batch_size': 128, 'positive_multiplier': 6}. Best is trial 2 with value: 0.1474792910540373.
[I 2026-06-08 11:37:16,664] Trial 5 finished with value: 0.18433013957950434 and parameters: {'lr': 0.0012141307774357361, 'optimizer': 'sgd', 'weight_decay': 0.0006720930050156114, 'dropout': 0.5, 'image_size': 96, 'batch_size': 64, 'positive_multiplier': 1}. Best is trial 2 with value: 0.1474792910540373.
[I 2026-06-08 11:41:30,172] Trial 6 finished with value: 0.1722428072696274 and parameters: {'lr': 6.907675985896193e-05, 'optimizer': 'adamw', 'weight_decay': 0.0035387588647792408, 'dropout': 0.30000000000000004, 'image_size': 160, 'batch_size': 64, 'positive_multiplier': 3}. Best is trial 2 with value: 0.1474792910540373.
[I 2026-06-08 11:42:49,961] Trial 7 pruned. 
[I 2026-06-08 11:46:41,040] Trial 8 pruned. 
[I 2026-06-08 11:48:24,729] Trial 9 pruned. 
[I 2026-06-08 11:49:55,193] Trial 10 pruned. 
[I 2026-06-08 11:54:10,163] Trial 11 finished with value: 0.16700412651848084 and parameters: {'lr': 0.00016685008725735048, 'optimizer': 'adamw', 'weight_decay': 0.009612279081140032, 'dropout': 0.5, 'image_size': 160, 'batch_size': 64, 'positive_multiplier': 3}. Best is trial 2 with value: 0.1474792910540373.
[I 2026-06-08 11:58:12,812] Trial 12 finished with value: 0.1483642196394894 and parameters: {'lr': 0.0003494517225231281, 'optimizer': 'adamw', 'weight_decay': 0.00026837193414400195, 'dropout': 0.5, 'image_size': 160, 'batch_size': 64, 'positive_multiplier': 2}. Best is trial 2 with value: 0.1474792910540373.
[I 2026-06-08 12:02:24,341] Trial 13 finished with value: 0.14633062256189372 and parameters: {'lr': 0.0004223161716556406, 'optimizer': 'adamw', 'weight_decay': 0.00033350164542030123, 'dropout': 0.6, 'image_size': 160, 'batch_size': 64, 'positive_multiplier': 2}. Best is trial 13 with value: 0.14633062256189372.
[I 2026-06-08 12:06:08,328] Trial 14 finished with value: 0.1647004505943543 and parameters: {'lr': 0.0005715735524108544, 'optimizer': 'adamw', 'weight_decay': 0.000180917280419763, 'dropout': 0.6, 'image_size': 128, 'batch_size': 256, 'positive_multiplier': 2}. Best is trial 13 with value: 0.14633062256189372.
[I 2026-06-08 12:08:40,002] Trial 15 finished with value: 0.16851744439036942 and parameters: {'lr': 0.0007599802996686772, 'optimizer': 'adamw', 'weight_decay': 3.6825066683453586e-06, 'dropout': 0.4, 'image_size': 96, 'batch_size': 64, 'positive_multiplier': 5}. Best is trial 13 with value: 0.14633062256189372.
[I 2026-06-08 12:12:49,602] Trial 16 finished with value: 0.1705893748004232 and parameters: {'lr': 0.0002040974893229403, 'optimizer': 'adamw', 'weight_decay': 0.0006602498791787793, 'dropout': 0.6, 'image_size': 160, 'batch_size': 64, 'positive_multiplier': 2}. Best is trial 13 with value: 0.14633062256189372.
[I 2026-06-08 12:14:29,839] Trial 17 pruned. 
[I 2026-06-08 12:15:47,948] Trial 18 pruned. 
[I 2026-06-08 12:20:08,779] Trial 19 finished with value: 0.11211258248361916 and parameters: {'lr': 0.000834778193385175, 'optimizer': 'adamw', 'weight_decay': 0.0002167586302241006, 'dropout': 0.0, 'image_size': 128, 'batch_size': 32, 'positive_multiplier': 5}. Best is trial 19 with value: 0.11211258248361916.
[I 2026-06-08 12:21:47,579] Trial 20 pruned. 
[I 2026-06-08 12:26:09,429] Trial 21 finished with value: 0.10524197181659725 and parameters: {'lr': 0.0006828068487917889, 'optimizer': 'adamw', 'weight_decay': 0.0004913846324386006, 'dropout': 0.0, 'image_size': 128, 'batch_size': 32, 'positive_multiplier': 5}. Best is trial 21 with value: 0.10524197181659725.
[I 2026-06-08 12:30:30,505] Trial 22 finished with value: 0.07920049836896312 and parameters: {'lr': 0.0010648875483276487, 'optimizer': 'adamw', 'weight_decay': 0.000541646657651192, 'dropout': 0.0, 'image_size': 128, 'batch_size': 32, 'positive_multiplier': 5}. Best is trial 22 with value: 0.07920049836896312.
[I 2026-06-08 12:34:56,348] Trial 23 finished with value: 0.10368378288890802 and parameters: {'lr': 0.001050335024953285, 'optimizer': 'adamw', 'weight_decay': 0.0013716998479802506, 'dropout': 0.0, 'image_size': 128, 'batch_size': 32, 'positive_multiplier': 5}. Best is trial 22 with value: 0.07920049836896312.
[I 2026-06-08 12:39:18,472] Trial 24 finished with value: 0.09127274224565947 and parameters: {'lr': 0.0012649004105545038, 'optimizer': 'adamw', 'weight_decay': 0.0017622428938565702, 'dropout': 0.0, 'image_size': 128, 'batch_size': 32, 'positive_multiplier': 5}. Best is trial 22 with value: 0.07920049836896312.
[I 2026-06-08 12:43:41,598] Trial 25 finished with value: 0.054058508243278486 and parameters: {'lr': 0.001239789430250594, 'optimizer': 'adamw', 'weight_decay': 0.0018452087946386937, 'dropout': 0.2, 'image_size': 128, 'batch_size': 32, 'positive_multiplier': 5}. Best is trial 25 with value: 0.054058508243278486.
[I 2026-06-08 12:45:23,613] Trial 26 pruned. 
[I 2026-06-08 12:49:37,338] Trial 27 finished with value: 0.10166667295369049 and parameters: {'lr': 0.0030186181356563575, 'optimizer': 'adamw', 'weight_decay': 0.0018902959098751361, 'dropout': 0.2, 'image_size': 128, 'batch_size': 32, 'positive_multiplier': 4}. Best is trial 25 with value: 0.054058508243278486.
[I 2026-06-08 12:51:17,065] Trial 28 pruned. 
[I 2026-06-08 12:52:53,088] Trial 29 pruned. 
Bester Trial: #25 | val_loss=0.0541
  batch_size: 32
  dropout: 0.2
  image_size: 128
  lr: 0.001239789430250594
  optimizer: adamw
  positive_multiplier: 5
  weight_decay: 0.0018452087946386937
Epoch 01/100 | train_loss=0.4341, train_acc=0.8077, train_recall=0.1352, train_f1=0.2200 | val_loss=0.2700, val_acc=0.9296, val_recall=0.3855, val_f1=0.3432
Epoch 02/100 | train_loss=0.3879, train_acc=0.8318, train_recall=0.2872, train_f1=0.4066 | val_loss=0.2338, val_acc=0.9345, val_recall=0.3404, val_f1=0.3314
Epoch 03/100 | train_loss=0.3632, train_acc=0.8435, train_recall=0.3570, train_f1=0.4778 | val_loss=0.2222, val_acc=0.9271, val_recall=0.3012, val_f1=0.2829
Epoch 04/100 | train_loss=0.3282, train_acc=0.8656, train_recall=0.4425, train_f1=0.5691 | val_loss=0.1449, val_acc=0.9753, val_recall=0.5392, val_f1=0.6755
Epoch 05/100 | train_loss=0.2376, train_acc=0.9168, train_recall=0.6345, train_f1=0.7537 | val_loss=0.1847, val_acc=0.9624, val_recall=0.7590, val_f1=0.6580
Epoch 06/100 | train_loss=0.2174, train_acc=0.9269, train_recall=0.6789, train_f1=0.7883 | val_loss=0.0982, val_acc=0.9795, val_recall=0.6416, val_f1=0.7487
Epoch 07/100 | train_loss=0.1997, train_acc=0.9342, train_recall=0.7108, train_f1=0.8125 | val_loss=0.1076, val_acc=0.9766, val_recall=0.6898, val_f1=0.7375
Epoch 08/100 | train_loss=0.1850, train_acc=0.9385, train_recall=0.7317, train_f1=0.8267 | val_loss=0.1336, val_acc=0.9721, val_recall=0.8012, val_f1=0.7328
Epoch 09/100 | train_loss=0.1666, train_acc=0.9455, train_recall=0.7683, train_f1=0.8497 | val_loss=0.1015, val_acc=0.9800, val_recall=0.8524, val_f1=0.8028
Epoch 10/100 | train_loss=0.1210, train_acc=0.9609, train_recall=0.8402, train_f1=0.8960 | val_loss=0.0897, val_acc=0.9800, val_recall=0.9066, val_f1=0.8124
Epoch 11/100 | train_loss=0.1039, train_acc=0.9669, train_recall=0.8678, train_f1=0.9133 | val_loss=0.0435, val_acc=0.9902, val_recall=0.8554, val_f1=0.8931
Epoch 12/100 | train_loss=0.0806, train_acc=0.9735, train_recall=0.8959, train_f1=0.9312 | val_loss=0.0466, val_acc=0.9904, val_recall=0.8946, val_f1=0.8986
Epoch 13/100 | train_loss=0.0741, train_acc=0.9767, train_recall=0.9075, train_f1=0.9397 | val_loss=0.0348, val_acc=0.9920, val_recall=0.8946, val_f1=0.9138
Epoch 14/100 | train_loss=0.0660, train_acc=0.9799, train_recall=0.9200, train_f1=0.9484 | val_loss=0.0352, val_acc=0.9920, val_recall=0.8645, val_f1=0.9111
Epoch 15/100 | train_loss=0.0601, train_acc=0.9816, train_recall=0.9287, train_f1=0.9530 | val_loss=0.0522, val_acc=0.9891, val_recall=0.9488, val_f1=0.8924
Epoch 16/100 | train_loss=0.0650, train_acc=0.9804, train_recall=0.9218, train_f1=0.9497 | val_loss=0.0286, val_acc=0.9934, val_recall=0.9066, val_f1=0.9290
Epoch 17/100 | train_loss=0.0542, train_acc=0.9829, train_recall=0.9351, train_f1=0.9565 | val_loss=0.0370, val_acc=0.9924, val_recall=0.9337, val_f1=0.9212
Epoch 18/100 | train_loss=0.0535, train_acc=0.9836, train_recall=0.9371, train_f1=0.9581 | val_loss=0.0239, val_acc=0.9941, val_recall=0.9307, val_f1=0.9378
Epoch 19/100 | train_loss=0.0493, train_acc=0.9850, train_recall=0.9438, train_f1=0.9620 | val_loss=0.0259, val_acc=0.9938, val_recall=0.9096, val_f1=0.9335
Epoch 20/100 | train_loss=0.0464, train_acc=0.9854, train_recall=0.9464, train_f1=0.9629 | val_loss=0.0714, val_acc=0.9842, val_recall=0.9639, val_f1=0.8533
Epoch 21/100 | train_loss=0.0472, train_acc=0.9856, train_recall=0.9454, train_f1=0.9634 | val_loss=0.0319, val_acc=0.9930, val_recall=0.9518, val_f1=0.9280
Epoch 22/100 | train_loss=0.0469, train_acc=0.9858, train_recall=0.9470, train_f1=0.9639 | val_loss=0.0613, val_acc=0.9882, val_recall=0.9789, val_f1=0.8880
Epoch 23/100 | train_loss=0.0454, train_acc=0.9859, train_recall=0.9468, train_f1=0.9641 | val_loss=0.0405, val_acc=0.9915, val_recall=0.9639, val_f1=0.9156
Epoch 24/100 | train_loss=0.0431, train_acc=0.9872, train_recall=0.9512, train_f1=0.9675 | val_loss=0.0219, val_acc=0.9947, val_recall=0.9578, val_f1=0.9450
Epoch 25/100 | train_loss=0.0432, train_acc=0.9876, train_recall=0.9537, train_f1=0.9686 | val_loss=0.0261, val_acc=0.9954, val_recall=0.9307, val_f1=0.9508
Epoch 26/100 | train_loss=0.0400, train_acc=0.9875, train_recall=0.9536, train_f1=0.9684 | val_loss=0.0451, val_acc=0.9904, val_recall=0.9789, val_f1=0.9066
Epoch 27/100 | train_loss=0.0401, train_acc=0.9875, train_recall=0.9546, train_f1=0.9684 | val_loss=0.0387, val_acc=0.9928, val_recall=0.9669, val_f1=0.9277
Epoch 28/100 | train_loss=0.0369, train_acc=0.9892, train_recall=0.9608, train_f1=0.9727 | val_loss=0.0208, val_acc=0.9957, val_recall=0.9608, val_f1=0.9551
Epoch 29/100 | train_loss=0.0389, train_acc=0.9888, train_recall=0.9590, train_f1=0.9716 | val_loss=0.0193, val_acc=0.9958, val_recall=0.9488, val_f1=0.9560
Epoch 30/100 | train_loss=0.0383, train_acc=0.9885, train_recall=0.9579, train_f1=0.9710 | val_loss=0.0172, val_acc=0.9958, val_recall=0.9548, val_f1=0.9563
Epoch 31/100 | train_loss=0.0379, train_acc=0.9885, train_recall=0.9584, train_f1=0.9710 | val_loss=0.0204, val_acc=0.9954, val_recall=0.9669, val_f1=0.9525
Epoch 32/100 | train_loss=0.0353, train_acc=0.9893, train_recall=0.9620, train_f1=0.9730 | val_loss=0.0179, val_acc=0.9957, val_recall=0.9578, val_f1=0.9550
Epoch 33/100 | train_loss=0.0380, train_acc=0.9890, train_recall=0.9595, train_f1=0.9721 | val_loss=0.0183, val_acc=0.9961, val_recall=0.9578, val_f1=0.9593
Epoch 34/100 | train_loss=0.0345, train_acc=0.9892, train_recall=0.9611, train_f1=0.9729 | val_loss=0.0177, val_acc=0.9957, val_recall=0.9458, val_f1=0.9544
Epoch 35/100 | train_loss=0.0347, train_acc=0.9900, train_recall=0.9640, train_f1=0.9749 | val_loss=0.0257, val_acc=0.9932, val_recall=0.9639, val_f1=0.9316
Epoch 36/100 | train_loss=0.0330, train_acc=0.9904, train_recall=0.9653, train_f1=0.9758 | val_loss=0.0198, val_acc=0.9948, val_recall=0.9548, val_f1=0.9463
Early Stopping nach Epoche 36: best_val_loss=0.0172
Test: loss=0.0244, accuracy=0.9948, recall=0.9401, f1=0.9458
Lernkurven gespeichert unter: /home/gartmaflorin@edu.local/Deep-Learning---Hackaton/project/plot/optuna_model_training_learning_curve.png
Confusion-Matrix gespeichert unter: /home/gartmaflorin@edu.local/Deep-Learning---Hackaton/project/plot/optuna_test_confusion_matrix.png
Bestes Modell gespeichert unter: /home/gartmaflorin@edu.local/Deep-Learning---Hackaton/project/models/optuna_model_optimization.pt
