Base-Modell nicht gefunden unter /home/gartmaflorin@edu.local/Deep-Learning---Hackaton/project/models/Simple_CNN_zuich.pt, nutze Fallback /home/gartmaflorin@edu.local/Deep-Learning---Hackaton/project/models/Simple_CNN_zurich.pt.
Nutze Device: cuda
Verbessere Base-Modell: /home/gartmaflorin@edu.local/Deep-Learning---Hackaton/project/models/Simple_CNN_zurich.pt
Starte Optuna mit 30 Trials ...
[I 2026-04-22 14:17:32,057] Trial 0 finished with value: 0.01573893309596678 and parameters: {'lr': 0.0001025350969016849, 'optimizer': 'adam', 'weight_decay': 4.2079886696066345e-06, 'dropout': 0.1, 'image_size': 128, 'batch_size': 128, 'positive_multiplier': 2}. Best is trial 0 with value: 0.01573893309596678.
[I 2026-04-22 14:19:25,999] Trial 1 finished with value: 0.06755232636674004 and parameters: {'lr': 3.0955664602423724e-05, 'optimizer': 'sgd', 'weight_decay': 5.34293726127978e-05, 'dropout': 0.2, 'image_size': 96, 'batch_size': 128, 'positive_multiplier': 4}. Best is trial 0 with value: 0.01573893309596678.
[I 2026-04-22 14:22:40,183] Trial 2 finished with value: 0.0443325459053503 and parameters: {'lr': 0.00039710847107924746, 'optimizer': 'adamw', 'weight_decay': 1.8205657658407268e-06, 'dropout': 0.6, 'image_size': 96, 'batch_size': 64, 'positive_multiplier': 3}. Best is trial 0 with value: 0.01573893309596678.
[I 2026-04-22 14:27:36,679] Trial 3 finished with value: 0.02200408017589094 and parameters: {'lr': 1.2382649697023537e-05, 'optimizer': 'adam', 'weight_decay': 1.7654048052495086e-05, 'dropout': 0.30000000000000004, 'image_size': 160, 'batch_size': 64, 'positive_multiplier': 6}. Best is trial 0 with value: 0.01573893309596678.
[I 2026-04-22 14:31:11,209] Trial 4 finished with value: 0.07966258326623782 and parameters: {'lr': 1.7331598058558698e-05, 'optimizer': 'sgd', 'weight_decay': 3.58681649862755e-05, 'dropout': 0.1, 'image_size': 96, 'batch_size': 128, 'positive_multiplier': 6}. Best is trial 0 with value: 0.01573893309596678.
[I 2026-04-22 14:32:29,847] Trial 5 pruned. 
[I 2026-04-22 14:35:42,536] Trial 6 finished with value: 0.016370169491856275 and parameters: {'lr': 6.907675985896193e-05, 'optimizer': 'adamw', 'weight_decay': 0.0035387588647792408, 'dropout': 0.30000000000000004, 'image_size': 160, 'batch_size': 64, 'positive_multiplier': 3}. Best is trial 0 with value: 0.01573893309596678.
[I 2026-04-22 14:37:29,144] Trial 7 pruned. 
[I 2026-04-22 14:38:57,430] Trial 8 pruned. 
[I 2026-04-22 14:43:41,349] Trial 9 finished with value: 0.019767009792468006 and parameters: {'lr': 0.0016136053172804803, 'optimizer': 'adam', 'weight_decay': 4.6735189995627506e-05, 'dropout': 0.1, 'image_size': 160, 'batch_size': 128, 'positive_multiplier': 6}. Best is trial 0 with value: 0.01573893309596678.
[I 2026-04-22 14:47:26,021] Trial 10 finished with value: 0.015073071040543935 and parameters: {'lr': 0.00014542559664513748, 'optimizer': 'adam', 'weight_decay': 1.0719864040714892e-06, 'dropout': 0.0, 'image_size': 128, 'batch_size': 256, 'positive_multiplier': 2}. Best is trial 10 with value: 0.015073071040543935.
[I 2026-04-22 14:49:18,763] Trial 11 finished with value: 0.0160736724892761 and parameters: {'lr': 0.00013631358911025642, 'optimizer': 'adam', 'weight_decay': 1.034130428036791e-06, 'dropout': 0.0, 'image_size': 128, 'batch_size': 256, 'positive_multiplier': 2}. Best is trial 10 with value: 0.015073071040543935.
[I 2026-04-22 14:53:03,827] Trial 12 finished with value: 0.015302788552401617 and parameters: {'lr': 0.0003104324524635878, 'optimizer': 'adam', 'weight_decay': 4.3673237959837505e-06, 'dropout': 0.0, 'image_size': 128, 'batch_size': 256, 'positive_multiplier': 2}. Best is trial 10 with value: 0.015073071040543935.
[I 2026-04-22 14:55:25,806] Trial 13 finished with value: 0.016341712564028686 and parameters: {'lr': 0.0003736276787248136, 'optimizer': 'adam', 'weight_decay': 6.2281132300923914e-06, 'dropout': 0.0, 'image_size': 128, 'batch_size': 256, 'positive_multiplier': 2}. Best is trial 10 with value: 0.015073071040543935.
[I 2026-04-22 14:58:29,101] Trial 14 finished with value: 0.017080673306884907 and parameters: {'lr': 0.0003895870682753875, 'optimizer': 'adam', 'weight_decay': 0.000180917280419763, 'dropout': 0.0, 'image_size': 128, 'batch_size': 256, 'positive_multiplier': 4}. Best is trial 10 with value: 0.015073071040543935.
[I 2026-04-22 15:02:03,749] Trial 15 finished with value: 0.015224137979560001 and parameters: {'lr': 4.59704573019567e-05, 'optimizer': 'adam', 'weight_decay': 5.035182021139862e-06, 'dropout': 0.4, 'image_size': 128, 'batch_size': 256, 'positive_multiplier': 1}. Best is trial 10 with value: 0.015073071040543935.
[I 2026-04-22 15:05:41,105] Trial 16 finished with value: 0.014942310939987666 and parameters: {'lr': 3.917803076031987e-05, 'optimizer': 'adamw', 'weight_decay': 2.0489383017884554e-06, 'dropout': 0.4, 'image_size': 128, 'batch_size': 256, 'positive_multiplier': 1}. Best is trial 16 with value: 0.014942310939987666.
[I 2026-04-22 15:09:16,420] Trial 17 finished with value: 0.01502129575793026 and parameters: {'lr': 0.00016241186410202848, 'optimizer': 'adamw', 'weight_decay': 0.00015900033318145976, 'dropout': 0.4, 'image_size': 128, 'batch_size': 256, 'positive_multiplier': 1}. Best is trial 16 with value: 0.014942310939987666.
[I 2026-04-22 15:10:48,997] Trial 18 pruned. 
[I 2026-04-22 15:12:10,010] Trial 19 pruned. 
[I 2026-04-22 15:13:36,646] Trial 20 pruned. 
[I 2026-04-22 15:15:57,264] Trial 21 finished with value: 0.016084098505646627 and parameters: {'lr': 0.0001507876114741918, 'optimizer': 'adamw', 'weight_decay': 2.294543057875094e-06, 'dropout': 0.5, 'image_size': 128, 'batch_size': 256, 'positive_multiplier': 2}. Best is trial 16 with value: 0.014942310939987666.
[I 2026-04-22 15:18:39,439] Trial 22 finished with value: 0.015503581399709641 and parameters: {'lr': 0.0002080556112257437, 'optimizer': 'adamw', 'weight_decay': 1.0311618665569777e-06, 'dropout': 0.2, 'image_size': 128, 'batch_size': 256, 'positive_multiplier': 1}. Best is trial 16 with value: 0.014942310939987666.
[I 2026-04-22 15:20:03,382] Trial 23 pruned. 
[I 2026-04-22 15:23:39,433] Trial 24 finished with value: 0.01539455431032102 and parameters: {'lr': 4.1197222108010334e-05, 'optimizer': 'adamw', 'weight_decay': 0.0005475779669393708, 'dropout': 0.6, 'image_size': 128, 'batch_size': 256, 'positive_multiplier': 1}. Best is trial 16 with value: 0.014942310939987666.
[I 2026-04-22 15:25:13,571] Trial 25 pruned. 
[I 2026-04-22 15:26:44,568] Trial 26 pruned. 
[I 2026-04-22 15:28:07,180] Trial 27 pruned. 
[I 2026-04-22 15:30:34,242] Trial 28 finished with value: 0.01635372887014233 and parameters: {'lr': 0.0001234008733801929, 'optimizer': 'adamw', 'weight_decay': 6.832949658420305e-05, 'dropout': 0.30000000000000004, 'image_size': 128, 'batch_size': 32, 'positive_multiplier': 2}. Best is trial 16 with value: 0.014942310939987666.
[I 2026-04-22 15:32:00,607] Trial 29 pruned. 
Bester Trial: #16 | val_loss=0.0149
  batch_size: 256
  dropout: 0.4
  image_size: 128
  lr: 3.917803076031987e-05
  optimizer: adamw
  positive_multiplier: 1
  weight_decay: 2.0489383017884554e-06
Epoch 01/100 | train_loss=0.0190, train_acc=0.9953, train_recall=0.9298, train_f1=0.9500 | val_loss=0.0174, val_acc=0.9947, val_recall=0.9337, val_f1=0.9437
Epoch 02/100 | train_loss=0.0186, train_acc=0.9950, train_recall=0.9227, train_f1=0.9465 | val_loss=0.0166, val_acc=0.9953, val_recall=0.9217, val_f1=0.9488
Epoch 03/100 | train_loss=0.0170, train_acc=0.9952, train_recall=0.9259, train_f1=0.9488 | val_loss=0.0161, val_acc=0.9955, val_recall=0.9277, val_f1=0.9521
Epoch 04/100 | train_loss=0.0180, train_acc=0.9954, train_recall=0.9253, train_f1=0.9500 | val_loss=0.0159, val_acc=0.9951, val_recall=0.9217, val_f1=0.9474
Epoch 05/100 | train_loss=0.0165, train_acc=0.9953, train_recall=0.9259, train_f1=0.9495 | val_loss=0.0161, val_acc=0.9955, val_recall=0.9217, val_f1=0.9518
Epoch 06/100 | train_loss=0.0175, train_acc=0.9950, train_recall=0.9201, train_f1=0.9466 | val_loss=0.0157, val_acc=0.9953, val_recall=0.9217, val_f1=0.9488
Epoch 07/100 | train_loss=0.0173, train_acc=0.9951, train_recall=0.9214, train_f1=0.9470 | val_loss=0.0154, val_acc=0.9955, val_recall=0.9277, val_f1=0.9521
Epoch 08/100 | train_loss=0.0171, train_acc=0.9952, train_recall=0.9278, train_f1=0.9486 | val_loss=0.0154, val_acc=0.9954, val_recall=0.9247, val_f1=0.9505
Epoch 09/100 | train_loss=0.0154, train_acc=0.9954, train_recall=0.9272, train_f1=0.9505 | val_loss=0.0151, val_acc=0.9955, val_recall=0.9307, val_f1=0.9522
Epoch 10/100 | train_loss=0.0157, train_acc=0.9953, train_recall=0.9278, train_f1=0.9499 | val_loss=0.0151, val_acc=0.9958, val_recall=0.9307, val_f1=0.9552
Epoch 11/100 | train_loss=0.0164, train_acc=0.9953, train_recall=0.9240, train_f1=0.9490 | val_loss=0.0152, val_acc=0.9960, val_recall=0.9307, val_f1=0.9567
Epoch 12/100 | train_loss=0.0164, train_acc=0.9952, train_recall=0.9227, train_f1=0.9483 | val_loss=0.0150, val_acc=0.9954, val_recall=0.9307, val_f1=0.9508
Epoch 13/100 | train_loss=0.0165, train_acc=0.9954, train_recall=0.9291, train_f1=0.9506 | val_loss=0.0155, val_acc=0.9958, val_recall=0.9247, val_f1=0.9549
Epoch 14/100 | train_loss=0.0160, train_acc=0.9952, train_recall=0.9259, train_f1=0.9485 | val_loss=0.0153, val_acc=0.9957, val_recall=0.9247, val_f1=0.9534
Epoch 15/100 | train_loss=0.0168, train_acc=0.9951, train_recall=0.9227, train_f1=0.9477 | val_loss=0.0152, val_acc=0.9958, val_recall=0.9277, val_f1=0.9550
Epoch 16/100 | train_loss=0.0160, train_acc=0.9952, train_recall=0.9265, train_f1=0.9485 | val_loss=0.0148, val_acc=0.9957, val_recall=0.9307, val_f1=0.9537
Epoch 17/100 | train_loss=0.0166, train_acc=0.9957, train_recall=0.9298, train_f1=0.9534 | val_loss=0.0152, val_acc=0.9958, val_recall=0.9277, val_f1=0.9550
Epoch 18/100 | train_loss=0.0166, train_acc=0.9950, train_recall=0.9195, train_f1=0.9466 | val_loss=0.0147, val_acc=0.9960, val_recall=0.9337, val_f1=0.9568
Epoch 19/100 | train_loss=0.0174, train_acc=0.9952, train_recall=0.9278, train_f1=0.9489 | val_loss=0.0157, val_acc=0.9957, val_recall=0.9217, val_f1=0.9533
Epoch 20/100 | train_loss=0.0177, train_acc=0.9951, train_recall=0.9220, train_f1=0.9471 | val_loss=0.0151, val_acc=0.9957, val_recall=0.9277, val_f1=0.9536
Epoch 21/100 | train_loss=0.0165, train_acc=0.9954, train_recall=0.9265, train_f1=0.9504 | val_loss=0.0151, val_acc=0.9958, val_recall=0.9277, val_f1=0.9550
Epoch 22/100 | train_loss=0.0173, train_acc=0.9950, train_recall=0.9246, train_f1=0.9466 | val_loss=0.0148, val_acc=0.9958, val_recall=0.9307, val_f1=0.9552
Epoch 23/100 | train_loss=0.0178, train_acc=0.9952, train_recall=0.9246, train_f1=0.9481 | val_loss=0.0149, val_acc=0.9957, val_recall=0.9307, val_f1=0.9537
Epoch 24/100 | train_loss=0.0164, train_acc=0.9956, train_recall=0.9298, train_f1=0.9531 | val_loss=0.0153, val_acc=0.9958, val_recall=0.9277, val_f1=0.9550
Early Stopping nach Epoche 24: best_val_loss=0.0147
Test: loss=0.0158, accuracy=0.9955, recall=0.9401, f1=0.9530
Lernkurven gespeichert unter: /home/gartmaflorin@edu.local/Deep-Learning---Hackaton/project/plot/optuna_model_training_learning_curve.png
Confusion-Matrix gespeichert unter: /home/gartmaflorin@edu.local/Deep-Learning---Hackaton/project/plot/optuna_test_confusion_matrix.png
Bestes Modell gespeichert unter: /home/gartmaflorin@edu.local/Deep-Learning---Hackaton/project/models/cnn_zurich_optuna_best.pt
